area,responsavel,status,prazo_retorno,decisao_esperada,observacao
ELEVATE DIGITAL / Aurora,Aurora,aprovado_com_ajustes_obrigatorios,2026-06-03,continuidade autorizada com ajustes obrigatorios,Direcao criativa premium Sports Tech aprovada; ajustar hero cinematografico visual preto dourado dashboards reais linguagem seria mobile premium e manter gates juridico CEO
Marketing,Marketing HUB-PODIUM,aprovado_com_observacoes,2026-06-03,continuidade e preparacao para publicacao autorizadas com observacoes de Marketing,Validacao registrada em docs/CMO_WEBSITE_PHASE1_VALIDATION_2026_05_29.md; canal de contato definido como ceo@hub-podium.com alinhar LinkedIn e manter comunicacao institucional sem venda
Juridico,Juridico HUB-PODIUM,aprovado_para_publicacao_institucional,2026-05-29,ok juridico para atualizacoes institucionais do site,Validacao registrada em docs/LEGAL_WEBSITE_PHASE1_VALIDATION_2026_05_29.md; manter controles sobre IA dados menores imagem video relatorios privacidade termos e qualquer captura futura
CEO,CEO Global HUB-PODIUM,aprovado_para_upload_fase1,2026-05-29,upload da versao institucional estatica autorizado,Validacao final registrada em docs/CEO_WEBSITE_PHASE1_FINAL_PUBLICATION_APPROVAL_2026_05_29.md; publicacao limitada ao site estatico sem backend CRM checkout upload ou coleta ampliada
CTO,Rafael Duarte,liberado_para_upload_fase1,2026-05-29,subir versao estatica e executar checklist pos-publicacao,Consolidacao registrada em docs/CTO_WEBSITE_PHASE1_FINAL_CONSOLIDATION_2026_05_29.md; checagem tecnica local aprovada; apos deploy validar dominio visual desktop mobile links contato e recebimento em ceo@hub-podium.com
